{
  "kind": "cineweave_execution_receipt",
  "contractVersion": "2.3.0",
  "receiptId": "receipt.blocked-external",
  "runtimeVersion": "2.3.1",
  "status": "blocked",
  "executionMode": "external",
  "requestArtifactRef": {
    "kind": "cineweave_execution_request",
    "id": "execution.external-without-approval",
    "version": 1,
    "contentHash": "sha256:aaaaaaaaaaaaaaaaaaaaaaaaaaaaaaaaaaaaaaaaaaaaaaaaaaaaaaaaaaaaaaaa"
  },
  "adapterDescriptorRef": {
    "kind": "cineweave_adapter_descriptor",
    "id": "adapter.external-example",
    "version": 1,
    "contentHash": "sha256:bbbbbbbbbbbbbbbbbbbbbbbbbbbbbbbbbbbbbbbbbbbbbbbbbbbbbbbbbbbbbbbb"
  },
  "capabilityProfileRef": {
    "kind": "cineweave_codex_capability_profile",
    "id": "capability.external-example",
    "version": 1,
    "contentHash": "sha256:cccccccccccccccccccccccccccccccccccccccccccccccccccccccccccccccc"
  },
  "idempotencyKey": "external:approval-missing:0001",
  "timing": {
    "startedAt": "2026-08-21T10:06:00.000Z",
    "finishedAt": "2026-08-21T10:06:00.002Z",
    "durationMs": 2
  },
  "authorizationEvidence": {
    "required": true,
    "decision": "missing",
    "approvalRecordHash": null,
    "exactRequestHashMatched": false
  },
  "attempts": [],
  "outputs": [],
  "costSummary": {
    "currency": "USD",
    "estimatedAmount": null,
    "actualAmount": 0,
    "withinBudget": true,
    "includesAllAttempts": true
  },
  "failure": {
    "stage": "authorization",
    "code": "approval.missing",
    "retryable": false,
    "message": "External execution lacks approval for the exact request."
  },
  "validation": {
    "adapterMatched": true,
    "requestHashMatched": true,
    "inputsMatched": true,
    "outputHashesVerified": false,
    "secretsAbsent": true,
    "externalSideEffectAuthorized": false
  }
}
