{
  "kind": "cineweave_execution_receipt",
  "contractVersion": "2.3.0",
  "receiptId": "receipt.fixture-portrait",
  "runtimeVersion": "2.3.0",
  "status": "succeeded",
  "executionMode": "fixture",
  "requestArtifactRef": {
    "kind": "cineweave_execution_request",
    "id": "execution.fixture-portrait",
    "version": 1,
    "contentHash": "sha256:aaaaaaaaaaaaaaaaaaaaaaaaaaaaaaaaaaaaaaaaaaaaaaaaaaaaaaaaaaaaaaaa"
  },
  "adapterDescriptorRef": {
    "kind": "cineweave_adapter_descriptor",
    "id": "adapter.fixture-svg",
    "version": 1,
    "contentHash": "sha256:bbbbbbbbbbbbbbbbbbbbbbbbbbbbbbbbbbbbbbbbbbbbbbbbbbbbbbbbbbbbbbbb"
  },
  "capabilityProfileRef": {
    "kind": "cineweave_codex_capability_profile",
    "id": "capability.fixture-svg",
    "version": 1,
    "contentHash": "sha256:cccccccccccccccccccccccccccccccccccccccccccccccccccccccccccccccc"
  },
  "idempotencyKey": "fixture:portrait:0001",
  "timing": {
    "startedAt": "2026-08-21T10:06:00.000Z",
    "finishedAt": "2026-08-21T10:06:00.012Z",
    "durationMs": 12
  },
  "authorizationEvidence": {
    "required": false,
    "decision": "not_required",
    "approvalRecordHash": null,
    "exactRequestHashMatched": true
  },
  "attempts": [
    {
      "attempt": 1,
      "status": "succeeded",
      "startedAt": "2026-08-21T10:06:00.000Z",
      "finishedAt": "2026-08-21T10:06:00.012Z",
      "providerRequestId": null,
      "retryReason": null,
      "errorCode": null,
      "costAmount": 0,
      "currency": "USD"
    }
  ],
  "outputs": [
    {
      "outputId": "output.fixture-portrait.01",
      "mediaKind": "image",
      "mimeType": "image/svg+xml",
      "byteLength": 512,
      "contentHash": "sha256:dddddddddddddddddddddddddddddddddddddddddddddddddddddddddddddddd",
      "storageRef": "executions/execution.fixture-portrait/output-01.svg",
      "width": 512,
      "height": 512,
      "durationMs": null
    }
  ],
  "costSummary": {
    "currency": "USD",
    "estimatedAmount": 0,
    "actualAmount": 0,
    "withinBudget": true,
    "includesAllAttempts": true
  },
  "failure": null,
  "validation": {
    "adapterMatched": true,
    "requestHashMatched": true,
    "inputsMatched": true,
    "outputHashesVerified": true,
    "secretsAbsent": true,
    "externalSideEffectAuthorized": true
  }
}
